{"$schema":"https://json-schema.org/draft/2020-12/schema","type":"object","additionalProperties":false,"required":["schema_version","status","assignment_count","eligibility","assignments","controls"],"properties":{"schema_version":{"const":"translation-source-assignments-v1"},"status":{"const":"metadata_planning_only"},"assignment_count":{"const":15},"eligibility":{"type":"object"},"assignments":{"type":"array","minItems":15,"maxItems":15,"items":{"type":"object","additionalProperties":false,"required":["id","phase","sources","languages","role","assertions","uses","lineage","gates","prohibitions"],"properties":{"id":{"type":"string","minLength":1},"phase":{"enum":["metadata_now","future_authorized"]},"sources":{"type":"array","minItems":1,"items":{"type":"string","minLength":1}},"languages":{"type":"array","minItems":1,"items":{"type":"string","minLength":1}},"role":{"type":"string","minLength":1},"assertions":{"type":"array","items":{"type":"string","minLength":1}},"uses":{"type":"array","minItems":1,"items":{"type":"string","minLength":1}},"lineage":{"type":"string","minLength":1},"gates":{"type":"array","minItems":1,"items":{"type":"string","minLength":1}},"prohibitions":{"type":"array","minItems":1,"items":{"type":"string","minLength":1}}}}},"controls":{"type":"object","additionalProperties":{"const":false}}}}
