{
  "schema_version": "translation-source-assignments-v1",
  "status": "metadata_planning_only",
  "assignment_count": 15,
  "eligibility": {
    "required": ["exact concept and BCP47 edition", "authorized payload purpose version and hash", "explicit directed assertion or governed direct relation", "predicate-compatible role", "known lineage", "valid prospective freeze", "reproducibility audit"],
    "reject": ["inferred inverse", "unapproved multi-hop", "edition or language inheritance", "aggregator or source-count voting", "reference leakage"]
  },
  "assignments": [
    {"id":"M01_route_feasibility","phase":"metadata_now","sources":["42 assertions"],"languages":["all"],"role":"route_rights_feasibility","assertions":["*"],"uses":["eligibility","semantic loss","rights queue"],"lineage":"no evidence count","gates":["metadata only"],"prohibitions":["term access","candidate generation"]},
    {"id":"M02_language_edition_opportunity","phase":"metadata_now","sources":["terminology registry"],"languages":["184 renditions"],"role":"coverage_gap_discovery","assertions":[],"uses":["language-script-region-edition coverage"],"lineage":"not applicable","gates":["metadata only"],"prohibitions":["variant collapse","availability as authorization"]},
    {"id":"M03_authorization_priority","phase":"metadata_now","sources":["artifacts and rights reviews"],"languages":["es","ja"],"role":"authorization_planning","assertions":[],"uses":["rank unblock work by overlap and HPO route"],"lineage":"not applicable","gates":["metadata only"],"prohibitions":["payload retrieval","external contact"]},
    {"id":"F01_withheld_hpo_reference","phase":"future_authorized","sources":["frozen HPO snapshots"],"languages":["es","ja"],"role":"withheld_hpo_reference","assertions":[],"uses":["evaluation after lock","drift replay"],"lineage":"one repository HPO group","gates":["community use","ethics/privacy","existing G3"],"prohibitions":["same-item generation","independent vote","promotion"]},
    {"id":"F02_mondo_ja_context","phase":"future_authorized","sources":["Mondo Japanese"],"languages":["ja"],"role":"disease_context","assertions":["mondo-hpo-lexical","mondo-hpo-xref"],"uses":["disambiguation","false-friend detection","close-match context"],"lineage":"imports never add votes","gates":["payload/version/hash","licence","community use","ethics/privacy","new freeze"],"prohibitions":["disease label substitution","xref equivalence"]},
    {"id":"F03_umls_es_ja_discovery","phase":"future_authorized","sources":["UMLS"],"languages":["es","ja"],"role":"aggregator_discovery","assertions":["hpo-umls"],"uses":["discovery","provenance","context"],"lineage":"origin vocabulary only; shared MedGen once","gates":["UTS licence","release","source rights","community use","ethics/privacy","new freeze"],"prohibitions":["CUI exact translation","hub vote"]},
    {"id":"F04_mesh_decs_es_lexical","phase":"future_authorized","sources":["MeSH","DeCS"],"languages":["es"],"role":"future_lexical_source","assertions":["hpo-mesh"],"uses":["synonym candidates after descriptor relation"],"lineage":"BIREME separate only with provenance","gates":["BIREME permission","product/version","MeSH-DeCS relation","community use","ethics/privacy","new freeze"],"prohibitions":["current use","other-language inference","mirror vote"]},
    {"id":"F05_snomed_es_ja_context","phase":"future_authorized","sources":["SNOMED CT"],"languages":["es","ja"],"role":"clinical_context","assertions":["hpo-snomed"],"uses":["clinical context"],"lineage":"exact edition only","gates":["licence","edition/effectiveTime/refset","language availability","community use","ethics/privacy","new freeze"],"prohibitions":["relatedMatch transfer","assumed Japanese","edition propagation"]},
    {"id":"F06_structural_upheno_mp","phase":"future_authorized","sources":["uPheno","MP"],"languages":["language-neutral"],"role":"structural_compositional","assertions":["hpo-upheno","hpo-mp"],"uses":["composition checks","hard negatives"],"lineage":"uPheno and MHMI separate and internally deduplicated","gates":["component rights","versions","new freeze"],"prohibitions":["lexical vote","cross-species label transfer"]},
    {"id":"F07_ncit_context","phase":"future_authorized","sources":["NCIt"],"languages":["future exact overlap"],"role":"oncology_context","assertions":["ncit-hpo"],"uses":["oncology context"],"lineage":"one NCIt lineage","gates":["rights","payload/version","language overlap","new freeze"],"prohibitions":["Option B generation","closeMatch identity"]},
    {"id":"F08_nando_ja_context","phase":"future_authorized","sources":["NANDO"],"languages":["ja"],"role":"disease_context","assertions":["nando-mondo","nando-orphanet"],"uses":["standalone context"],"lineage":"one NANDO/import group","gates":["release","rights","direct HPO relation or context protocol","new freeze"],"prohibitions":["multi-hop to HPO","label transfer"]},
    {"id":"F09_orphanet_context","phase":"future_authorized","sources":["Orphadata products"],"languages":["product-specific"],"role":"disease_context","assertions":["orphanet-mondo","orphanet-umls","orphanet-mesh","orphanet-meddra","orphanet-icd10","orphanet-icd11","orphanet-omim"],"uses":["context","coverage gaps"],"lineage":"one Orphanet KB lineage per product","gates":["product/language vintage","rights","direct HPO relation","new freeze"],"prohibitions":["multi-hop HPO inference","product collapse"]},
    {"id":"F10_regional_canada","phase":"future_authorized","sources":["SNOMED Canada","ICD-10-CA"],"languages":["en-CA","fr-CA"],"role":"regional_classification_context","assertions":["snomed-canada-icd10ca-2022"],"uses":["regional negative control"],"lineage":"one CIHI/SNOMED map lineage","gates":["dual licences","package","direct HPO route","new freeze"],"prohibitions":["global generalization","HPO lexical evidence","fr-CA collapse"]},
    {"id":"F11_unmapped_supplementary","phase":"future_authorized","sources":["PRO-CTCAE","WHO ICF","RadLex","Uberon","Cell Ontology","PATO"],"languages":["source-specific"],"role":"context_or_structural","assertions":["uberon-fma","uberon-ncit","uberon-snomed","cell-fma","cell-ncit","cell-snomed","cell-uberon"],"uses":["specialty context","structural checks","hard negatives"],"lineage":"each bridge family once","gates":["rights","version","direct relation for lexical use","new freeze"],"prohibitions":["unmapped transfer","structural lexical vote"]},
    {"id":"F12_disease_aggregates","phase":"future_authorized","sources":["DO","EFO","DECIPHER","OMIM","OncoTree","ICD-10","ICD-11","MedDRA","LOINC","FMA","LDDB"],"languages":["source-specific"],"role":"discovery_or_context","assertions":["mondo-decipher","mondo-do","mondo-efo","mondo-icd10","mondo-icd11","mondo-meddra","mondo-omim","mondo-oncotree","loinc-snomed"],"uses":["route discovery","domain context","gap analysis"],"lineage":"Mondo aggregate xrefs one lineage","gates":["access/rights","release","direct HPO relation","new freeze"],"prohibitions":["transitive chaining","disease label substitution"]}
  ],
  "controls": {"payload_retrieval_authorized":false,"candidate_generation_authorized":false,"routes_authorize_payload":false,"automatic_promotion":false}
}
